{
  "schema_version": "1.0",
  "action": "CAO_BREAK_GLASS_RESTART",
  "approved": true,
  "approved_by": "operator",
  "reason": "Emergency maintenance is required and checkpoint fallback has been accepted.",
  "issued_at": "2026-08-06T04:00:00Z",
  "expires_at": "2026-08-06T04:30:00Z",
  "acknowledge_active_sessions_will_be_destroyed": true
}
